{
	"url": "https://example.com",
	"users": {
		"customer": {
			"username": "",
			"password": ""
		},
		"admin": {
			"username": "",
			"password": ""
		}
	},
	"selectors": {
		"loginLink": "#login-link",
		"logoutLink": "#logout-link",
		"usernameField": "#username",
		"passwordField": "#password",
		"loginButton": "#login-button"
	},
	"initialState": "notLoggedIn",
	"flows": {
		"login": {
			"requireUser": true,
			"inputState": "notLoggedIn",
			"steps": [
				"Goto /",
				"See loginLink",
				"Click loginLink",
				"Page reloads",
				"See usernameField",
				"Type in usernameField user.username",
				"See usernameField",
				"Type in usernameField user.username"
			],
			"outputState": "loggedIn"
		},
		"logout": {
			"inputState": "loggedIn",
			"steps": [
				"goto page /my-dashboard",
				"see logoutLink",
				"click logoutLink",
				"see loginLink"
			],
			"outputState": "notLoggedIn"
		}
	}
}

